<?xml version="1.0" encoding="UTF-8"?>
<tns:service xmlns:tns="http://www.example.org/StreamingService/" xmlns:xsi="http://www.w3.org/2001/XMLSchema-instance" xsi:schemaLocation="http://www.example.org/StreamingService/ ServiceUtils/StreamingService.xsd ">
  <address>127.0.0.1:13012</address>
  <inputs>
  	<input>
  		<id>1</id>
  		<formats>
  			<format>
  				<name>char_stream</name>
  				<latency>5</latency>
  			</format>
  		</formats>
  	</input></inputs>
  <outputs>
  	<output>
  		<id>2</id>
  		<formats>
  			<format>
  				<name>lower_char_stream</name>
  				<latency>5</latency>
  			</format>
  		</formats>
  	</output>
  	</outputs>
  <cost>2.0</cost>
  <latency>1.5</latency>
  <maxInstCount>1000</maxInstCount>
  <serviceGlobalId>127.0.0.1:13012</serviceGlobalId>
  <classes>
    <class>string_lower</class>
  </classes>
  <parameters/>
</tns:service>